,NewsID,Text,NewsCategory,BertEmotion,Text2Emotion,NewsSensitivity,NewsPolarity,NewsHandler,LoveCnt,FearCnt,JoyCnt,SadnessCnt,SurpriseCnt,AngerCnt
1117,1556696764094242817,two highly radicalised nationals allegedly involved propagating jihad by posting hateful incriminating materials online were arrested bhopal madhya pradesh spokesperson said august 8,tech,Sadness,Fear,0.31999999999999995,Happy,the_hindu,0,0,0,0,0,0
1118,1556695509523365888,mother amp father should have equal rights as guardians their children hindu minority guardianship act 1956 should be amended as it discriminates against women parliamentary panel has recommended report reports,politics,Love,Fear,0.25,Fear,the_hindu,1,0,0,0,0,0
1119,1556694269783674881,prime minister august 8 2022 said as far as he knew outgoing vice president m venkaiah naidu his farewell is not possible as people will keep calling him something or other,politics,Love,Fear,0.7916666666666666,Fear,the_hindu,0,0,0,0,0,0
1120,1556692980676820994,last month national leadership made it clear that alliance between party was be held onto,politics,Love,Fear,0.22499999999999998,Sad,the_hindu,0,0,0,0,0,0
1121,1556691745357893632,senior anubrata mondal skipped summons issued by cattle smuggling scam leader has sent email informing that he will not be able present before agency august 8,tech,Love,Fear,0.3125,Surprise,the_hindu,0,0,0,0,0,0
1122,1556689612629753857,todays editors pick newsletter read about failure launch its maiden sslv into correct orbit here is preview,entertainment,Love,Fear,0.3,Sad,the_hindu,0,0,0,0,0,0
1123,1556689350347440129,rt senior fast bowler is set be ruled out tournament with back injury which woul,sport,Fear,Fear,0.3,Fear,the_hindu,0,0,0,0,0,0
1124,1556687975840645128,todays evening wrap newsletter read about how has blamed states prolonged delay releasing findings seventh economic census more heres preview,entertainment,Fear,Fear,0.35,Sad,the_hindu,0,0,0,0,0,0
1125,1556687971335684096,ambassador died suddenly sunday southwestern chinese city kunming according obituary myanmar state media diplomatic sources,business,Fear,Fear,0.25,Sad,the_hindu,0,0,0,0,0,0
1126,1556932072035565569,nayanthara beyond fairytale will chart relationship marriage directed by streaming platform has announced intimate documentary couples relationship marriage,entertainment,Love,Fear,0.3,Happy,the_hindu,0,0,0,0,0,0
1127,1556930809889693696,paid tribute victims u s atomic bombing 77 years ago with mayor saying russias war ukraine showed world that another nuclear attack is not just worry but tangible present crisis,politics,Love,Fear,0.0,Sad,the_hindu,0,0,0,0,0,0
1128,1556928345954205698,foreign minister said that aims control east south china seas via taiwan strait describing greater ambition upend asia pacific status quo prevent nations aiding self governing island,business,Love,Fear,0.3125,Sad,the_hindu,0,0,0,0,0,0
1129,1556927034655375362,fusion bistro off karaikudi road springs surprise with its blended tastes flavours heartland,entertainment,Love,Fear,0.0,Surprise,the_hindu,0,0,0,0,0,0
1130,1556925778490982401,high court has expressed its strong displeasure over tardy progress criminal cases filed concerning elephant cases stating that trial has not commenced 13 out 14 cases reports,business,Sadness,Fear,0.6077777777777778,Sad,the_hindu,0,0,0,0,0,0
1131,1556923245433061376,inc is early stages planning layoffs verge reported citing people familiar with plans scope job cuts is currently unclear as managers are still planning it their teams report said,business,Joy,Fear,0.4000000000000001,Fear,the_hindu,0,0,0,0,0,0
1132,1556921979445321728,marks fourth collaboration between film director actor after their films like duo promise promise heartwarming family drama,entertainment,Love,Fear,0.0,Surprise,the_hindu,0,0,0,0,0,0
1133,1556920741697884160,chief minister is set meet governor meeting convened by mr kumar discuss situation his party he formally announced that alliance between u has broken off,politics,Fear,Fear,0.4,Fear,the_hindu,4,1,0,2,0,0
1134,1556918216039010309,value beyond 2 0 showcasing paintings sculptures limited edition serigraphs has something that everyone can relate though varied form expression works have common narrative positivity,tech,Love,Fear,0.3214285714285714,Fear,the_hindu,0,0,0,0,0,0
1135,1556918213677572098,u s is doubling down its investment pacific said u s deputy secretary state as she concluded five nation visit region,business,Love,Fear,0.2888888888888889,Sad,the_hindu,0,0,0,0,0,0
1136,1556917758150983681,rt social currency season 2 fabulous lives bollywood wives season 2,business,Love,Happy,0.5333333333333333,Happy,the_hindu,0,0,0,0,0,0
1137,1556915703395061761,heads chipmakers carmakers co were meet at closed door summit with u s government officials discuss administration plans invest semiconductors,business,Love,Fear,0.1,Happy,the_hindu,0,0,0,0,0,0
1138,1556913225656057857,much awaited expansion cabinet bjp shiv sena government led by took place with 18 legislators taking oath as ministers,politics,Love,Sad,0.2,Surprise,the_hindu,0,0,0,0,0,0
1139,1556911928425021442,what has life been like art director after winning best production design film he speaks about his journey through film past works,entertainment,Love,Fear,0.43333333333333335,Fear,the_hindu,0,0,0,0,0,0
1140,1556910676911742978,chief nominated party mlc ambadas danve post leader opposition legislative council,politics,Love,Sad,0.0,Surprise,the_hindu,0,0,0,0,0,0
1141,1556908147373129728,continues face criticism immigrant refugee advocates that administration has fallen short resettling afghans who assisted u s war effort,business,Fear,Fear,0.3,Angry,the_hindu,0,0,0,0,0,0
1142,1556905656505999360,comptroller auditor general has criticised railways over its system almost all sectors stations coaching depots maintenance production units as well as bio medical waste generated its hospitals,business,Sadness,Fear,0.16666666666666666,Fear,the_hindu,0,0,0,0,0,0
1143,1556903511127953409,rt raksha bandhan karthis viruman tovino thomas thallumaala ravi,sport,Love,Surprise,0.0,Surprise,the_hindu,0,0,0,0,0,0
1144,1556903128267644933,whatsapp message threatening kill chief minister was received state polices text helpline following which case was registered against man official said,politics,Sadness,Sad,0.1,Surprise,the_hindu,2,1,0,0,0,0
1145,1556900590202003456,this weeks view india writes death al qaedas ayman al zawahiri more preview subscribe here,entertainment,Fear,Fear,0.5,Fear,the_hindu,0,0,0,0,0,0
1146,1557298260569735168,firefighters specialists mexico venezuela help cuba bring oil depot fire under control after five day blaze,business,Love,Fear,0.0,Sad,AJEnglish,0,0,0,0,0,0
1147,1557291630025216001,eu member states will not be allowed import any more coal russia after transitional period blocs embargo ends at midnight wednesday live updates,business,Love,Surprise,0.5,Surprise,AJEnglish,0,0,0,0,0,0
1148,1557285802949885952,blasts rock russian military airbase annexed crimea,entertainment,Fear,Fear,0.05,Surprise,AJEnglish,0,0,0,0,0,0
1149,1557281183993675776,trauma experienced by palestinians gaza did not start last week it started decades ago when zionist movement first set its sight palestine as land which embark upon its settler colonial project by,tech,Fear,Fear,0.43333333333333335,Fear,AJEnglish,2,4,2,1,0,0
1150,1557277303389954048,this tree chile nicknamed great grandfather is thought be worlds oldest living thing,entertainment,Love,Sad,0.75,Happy,AJEnglish,2,3,1,0,0,0
1151,1557272807821787136,russia ukraine war august 10 updates russian shelling has killed 13 people ukraines central dnipropetrovsk region overnight says local governor valentyn reznychenko follow our live coverage,business,Fear,Surprise,0.15,Surprise,AJEnglish,5,5,0,0,0,0
1152,1557267062405332993,stranded beluga whale rescued seine river northern france,business,Fear,Fear,0.0,Surprise,AJEnglish,0,0,0,0,0,0
1153,1557261649689583616,elon musk sells nearly 7bn worth telsa shares avoid emergency sale as twitter trial looms,business,Love,Fear,0.25,Fear,AJEnglish,4,1,0,0,0,0
1154,1557257787931082752,how many more children do we have bury until someone says enough is enough palestinian ambassador riyad mansour,entertainment,Love,Fear,0.5,Surprise,AJEnglish,0,0,0,0,0,0
1155,1557251989372821504,claims itself everything that it denies us palestines un envoy riyad mansour called out israel over its deadly bombardment gaza during emergency meeting at security council new york,business,Sadness,Sad,0.42727272727272725,Surprise,AJEnglish,5,4,1,0,0,0
1156,1557222724279451648,republicans slam fbi search trumps home democrats cautious,politics,Joy,Fear,0.0,Surprise,AJEnglish,3,2,1,1,0,0
1157,1557218948935999489,stranded beluga whale rescued seine northern france,sport,Fear,Fear,0.0,Surprise,AJEnglish,1,1,0,0,0,0
1158,1557215296628441089,indonesian mothers fight medical marijuana their children,politics,Sadness,Fear,0.0,Sad,AJEnglish,2,0,0,0,0,0
1159,1557203834908250114,at least eight people died seoul after torrential rain caused power outages left roads subways submerged pictures,tech,Fear,Fear,0.2,Fear,AJEnglish,1,4,0,1,0,0
1160,1557203834258071554,papua new guineas parliament has returned pm james marape power following elections south pacific island nation,politics,Love,Fear,0.2772727272727273,Angry,AJEnglish,1,1,0,0,0,0
1161,1557202491485442048,armed fighters with suspected affiliation isis group killed 17 malian soldiers 4 civilians during attack,politics,Sadness,Fear,0.0,Surprise,AJEnglish,2,4,0,0,0,0
1162,1557202143953698817,us federal appeals court has ruled that congressional committee has right see former president donald trumps tax returns,business,Love,Fear,0.26785714285714285,Fear,AJEnglish,3,3,0,2,0,0
1163,1557201934469169154,rt we dont want keep going through this nine year old leen matar was her grandfathers house when it was hit by,entertainment,Joy,Angry,0.2,Angry,AJEnglish,0,0,0,0,0,0
1164,1557196284880117763,us scraps remain mexico policy after supreme court ruling,business,Fear,Fear,0.0,Fear,AJEnglish,1,3,0,0,0,0
1165,1557184962834575361,issey miyake who built one japans biggest fashion brands was known his boldly sculpted signature pleated pieces has died pictures,entertainment,Love,Fear,0.6666666666666666,Fear,AJEnglish,0,0,0,0,0,0
1166,1557297171590008833,kenya elections 2022 raila odinga william ruto tight race president,politics,Sadness,Fear,0.2857142857142857,Fear,BBCWorld,3,6,0,0,0,0
1167,1557283331674357760,guinness fuelled man runs width ireland day,sport,Love,Fear,0.0,Happy,BBCWorld,5,4,0,1,0,0
1168,1557274307306332161,plucky pooches ride waves at dog surfing championships,sport,Love,Fear,0.0,Fear,BBCWorld,2,1,6,1,0,0
1169,1557265796317028352,could trump investigation stop him running 2024,tech,Love,Surprise,0.0,Surprise,BBCWorld,4,2,0,4,0,0
1170,1557256867709177857,ukraine war must end with liberation crimea says zelensky,politics,Love,Fear,0.0,Surprise,BBCWorld,5,3,0,1,1,0
1171,1557249257635291136,republican uproar over fbi raid trumps florida home,entertainment,Sadness,Fear,0.0,Surprise,BBCWorld,7,1,0,2,0,0
1172,1557241860166492160,fast food giant dominos pulls out birthplace pizza,business,Love,Fear,0.8,Surprise,BBCWorld,5,4,0,0,0,1
1173,1557237939310153730,multi billionaire elon musk sells another 6 9bn tesla shares,business,Love,Fear,0.0,Surprise,BBCWorld,5,5,0,0,0,0
1174,1557203643937464320,homes needed 4 000 beagles rescued breeder us,politics,Fear,Fear,0.0,Sad,BBCWorld,4,4,0,1,0,1
1175,1557199125904515073,ukraine war must end with liberation crimea zelensky,politics,Love,Fear,0.0,Surprise,BBCWorld,3,5,0,2,0,0
1176,1557157809883676678,donald trump supporters upset with fbi search,tech,Sadness,Surprise,0.0,Surprise,BBCWorld,4,4,0,2,0,0
1177,1557157765415591937,katty kay will fbi raid supercharge trump,sport,Love,Surprise,0.0,Surprise,BBCWorld,5,3,1,1,0,0
1178,1557157503699410946,us jury declines indict woman whose accusation led 1955 lynching emmett till,entertainment,Sadness,Fear,0.0,Surprise,BBCWorld,4,3,0,2,1,0
1179,1557147464754413568,laal singh chaddha how aamir khan adapted forrest gump bollywood,entertainment,Love,Sad,0.0,Surprise,BBCWorld,6,3,0,1,0,0
1180,1557145777285337088,china property crisis why homeowners stopped paying their mortgages,business,Fear,Fear,0.0,Fear,BBCWorld,7,1,0,1,0,1
1181,1557145218406907904,ex inmates reveal details russia prison torture scandal,politics,Fear,Fear,0.0,Surprise,BBCWorld,4,4,0,2,0,0
1182,1557128706828734464,france whale rescue operation begins save beluga stuck seine,sport,Love,Fear,0.0,Fear,BBCWorld,4,5,1,0,0,0
1183,1557125090168414209,donald trump supporters upset with fbi search,tech,Sadness,Surprise,0.0,Surprise,BBCWorld,6,3,0,0,1,0
1184,1557117538777038848,us police arrest man over murders muslim men,politics,Sadness,Fear,0.0,Surprise,BBCWorld,3,4,0,2,1,0
1185,1557109983770288131,crimea beachgoers run after airfield explosion,tech,Fear,Surprise,0.0,Surprise,BBCWorld,5,3,1,1,0,0
1186,1557298243993731074,lifestyle remote tribal hamlet sarkhipara tripuras district has gone sea change as after remaining dark 80 years it is now shining bright with help,entertainment,Love,Fear,0.4666666666666666,Sad,the_hindu,0,0,0,0,0,0
1187,1557295706196541442,cabinet renewal was second just 10 months since mr took office following july election victory that had been expected ensure long term stability until 2025,politics,Love,Fear,0.225,Fear,the_hindu,0,0,0,0,0,0
1188,1557294451625795584,actor era inspired ensemble by his collection showcased partnership with department handlooms textiles government added sheen,entertainment,Love,Fear,0.0,Sad,the_hindu,0,0,0,0,0,0
1189,1557293303707623424,after taking oath chief minister told media persons that he would not be cm 2024 pm mr kumar said he mr modi had come power 2014 but not sure he would remain there 2024,politics,Love,Surprise,0.8888888888888888,Surprise,the_hindu,0,0,0,0,0,0
1190,1557293195217739776,over 900 people died road accidents caused by stray cattle last five years state government has informed assembly,politics,Fear,Sad,0.06666666666666667,Fear,the_hindu,1,0,0,0,0,0
1191,1557290687758057479,tamil nadu government would award cash prize 1 crore each indias b team open team women which secured bronze medals 44th fide chief minister m k stalin announced wednesday,sport,Love,Fear,0.5,Fear,the_hindu,0,0,0,0,0,0
1192,1557289420092542976,2016 winner speaks about adapting his play screen political nature his plays role that budget played materialising his vision his first film,entertainment,Love,Fear,0.21666666666666667,Fear,the_hindu,0,0,0,0,0,0
1193,1557288169682489344,greek authorities say major search rescue operation has been launched east island after boat reportedly carrying dozens migrants sank during night,business,Joy,Fear,0.25,Sad,the_hindu,0,0,0,0,0,0
1194,1557287593087229956,only cm deputy cm took oath office today other cabinet members will be taking oath later,politics,Love,Surprise,0.4583333333333333,Surprise,the_hindu,0,0,0,0,0,0
1195,1557285637316804608,planned executed less than four months was roaring success not just with respect participation but also hospitality entertainment,tech,Love,Fear,0.03333333333333333,Sad,the_hindu,0,0,0,0,0,0
1196,1557285187905527808,swearing ceremony chief minister deputy cm begins at raj bhawan patna reports,politics,Love,Angry,0.0,Angry,the_hindu,6,1,0,0,0,0
1197,1557284380925632513,exhibition erstwhile ruler who made officials quake their boots has been showcased through lens companys painters at this art gallery,entertainment,Love,Fear,0.1,Surprise,the_hindu,0,0,0,0,0,0
1198,1557283114963058688,inc said tuesday it had fixed issues after thousands users reported that they were having trouble accessing micro blogging platform,tech,Fear,Fear,0.2,Sad,the_hindu,0,1,0,0,0,0
1199,1557280787191529472,stripped power bihar staged massive demonstration condemning betrayal chief minister whose similar volte face five years ago had helped it join government through proverbial back door,business,Sadness,Sad,0.4666666666666666,Sad,the_hindu,1,1,0,0,0,0
1200,1557280609864519680,daily quiz occasion national day celebrated every year august 9 singapore has four official languages if three are english malay mandarin what is fourth,sport,Love,Fear,0.1875,Happy,the_hindu,3,0,0,0,0,0
1201,1557279768193671168,archaeological survey india wednesday announced that entry all ticketed centrally protected monuments would be free charge august 5 august 15 as part,business,Love,Fear,0.35000000000000003,Happy,the_hindu,0,0,0,0,0,0
1202,1557279359882465286,hindus archives leaf through pages hindu experience history making as our readers experienced it that day we have extracted select articles including those written by v k c v raman,tech,Love,Surprise,0.9,Sad,the_hindu,0,0,0,0,0,0
1203,1557279345588191233,there are legions fans who this month marks 60 years vast imaginative world comic books movies merch appeal long ago transcended its original iteration as white unimposing orphaned teenager,entertainment,Love,Fear,0.5583333333333333,Fear,the_hindu,0,0,0,0,0,0
1204,1557278087393443840,telecommunications regulator said tuesday it plans launch investigation into app store operators such as inc alphabets google one store over suspected violations app payment law,tech,Joy,Fear,0.5,Surprise,the_hindu,0,0,0,0,0,0
1205,1557275597067411458,china august 10 reaffirmed its threat use military force bring self governing under its control amid threatening chinese military exercises that have raised tensions between sides their highest level years,business,Sadness,Fear,0.06666666666666667,Fear,the_hindu,0,0,0,0,0,0
1206,1557407700157448195,former us president trump refused answer questions during investigation into his business dealing before new york state attorney general,business,Sadness,Fear,0.3181818181818182,Surprise,AJEnglish,3,0,0,1,0,0
1207,1557403920871444482,rt this tree chile nicknamed great grandfather is thought be worlds oldest living thing,entertainment,Love,Sad,0.75,Happy,AJEnglish,0,0,0,0,0,0
1208,1557400128415305729,former russian tv journalist has been detained as part criminal investigation allegedly spreading false information about russian armed forces,business,Sadness,Fear,0.20833333333333334,Sad,AJEnglish,0,0,0,0,0,0
1209,1557396670886936576,rt stories you shouldnt miss today august 10,sport,Fear,Sad,0.0,Sad,AJEnglish,0,0,0,0,0,0
1210,1557392600365256710,huge wildfire that has destroyed more than dozen homes forced evacuation thousands residents through frances gironde,tech,Fear,Fear,0.5333333333333333,Fear,AJEnglish,4,3,0,0,0,0
1211,1557388810018775043,rt 22 year old hilda f nakabuye witnessed devastation climate change when floods wiped out her family home land,sport,Fear,Surprise,0.2,Surprise,AJEnglish,0,0,0,0,0,0
1212,1557385048957009920,black brown migrant bodies are as much danger europe as they are america by tafi mhaka,politics,Joy,Fear,0.31666666666666665,Sad,AJEnglish,3,3,1,3,0,0
1213,1557377683331469312,wagner group mysterious russian network mercenaries is embracing ever public image as war ukraine drags,business,Joy,Fear,0.35555555555555557,Surprise,AJEnglish,0,0,0,0,0,0
1214,1557373827461652482,millions afghan lives are hit by western sanctions leading withdrawal development support pictures,business,Fear,Fear,0.0,Surprise,AJEnglish,5,4,0,1,0,0
1215,1557370210759352322,rt claims itself everything that it denies us palestines un envoy riyad mansour called out israel over its,business,Sadness,Surprise,0.0,Surprise,AJEnglish,0,0,0,0,0,0
1216,1557366225327497217,un several human rights organisations have condemned repeated use emergency regulations against peaceful protesters by sri lanka govt,business,Sadness,Fear,0.19999999999999998,Surprise,AJEnglish,1,1,0,0,0,0
1217,1557358645452718080,bci faced scrutiny over its work after partnering with chinese firm accused rights abuses,politics,Sadness,Fear,0.2,Fear,AJEnglish,1,1,0,0,0,0
1218,1557355265871286275,rt qatar world cup 2022 is set start day earlier november 20 following opening ceremony,sport,Love,Fear,0.3,Fear,AJEnglish,0,0,0,0,0,0
1219,1557351057608413184,ukrainian president volodymyr zelenskyy is being turned into action figure by us company after online crowdfunding campaign,tech,Love,Sad,0.1,Surprise,AJEnglish,0,0,0,0,0,0
1220,1557343509559947265,muslims worldwide mark day ashura tenth day muharram first month islamic lunar calendar pictures,entertainment,Love,Fear,0.3333333333333333,Happy,AJEnglish,4,1,0,1,0,0
1221,1557339567073763330,chinas ambassador australia says change government canberra offers opportunity reset ties,business,Love,Fear,0.0,Happy,AJEnglish,2,2,0,0,0,0
1222,1557333558305632256,it is with sadness that we announce cetaceans death beluga whale which was stranded frances river seine has died during attempt rescue it free it coastal waters,entertainment,Fear,Sad,0.8,Fear,AJEnglish,0,0,0,0,0,0
1223,1557330704438009857,stories you shouldnt miss today august 10,sport,Fear,Sad,0.0,Sad,AJEnglish,0,2,0,0,0,0
1224,1557328923456856064,greece searches dozens people after migrant boat sinks off island karpathos,tech,Joy,Fear,0.0,Sad,AJEnglish,1,3,1,2,0,0
1225,1557321239106146305,ukrainian president volodymyr zelenskyy is being made into action figure by product design company brooklyn new york action figure will be mass produced plastic china,business,Love,Fear,0.21818181818181817,Fear,AJEnglish,0,0,0,0,0,0
1226,1557404427958599682,us inflation eases july as petrol prices drop,business,Fear,Fear,0.0,Fear,BBCWorld,8,2,0,0,0,0
1227,1557397243375882241,ex inmates speak out over russia prison rape scandal,business,Sadness,Fear,0.0,Surprise,BBCWorld,4,5,0,1,0,0
1228,1557388833070751744,donald trump refuses answer questions new york investigation into familys business practices,business,Sadness,Surprise,0.45454545454545453,Surprise,BBCWorld,3,4,1,1,0,1
1229,1557382525458305025,fast food giant dominos pulls out birthplace pizza,business,Love,Fear,0.8,Surprise,BBCWorld,7,3,0,0,0,0
1230,1557374277736955905,world cup 2022 set start one day earlier than planned,sport,Love,Fear,0.5,Happy,BBCWorld,3,6,0,1,0,0
1231,1557365924834992129,ukraine war must end with liberation crimea says zelensky,politics,Love,Fear,0.0,Surprise,BBCWorld,1,3,1,4,1,0
1232,1557361292557557762,ex inmates speak out over russia prison rape scandal,business,Sadness,Fear,0.0,Surprise,BBCWorld,4,4,0,2,0,0
1233,1557357410678972428,china says taiwan military drills are over after pelosi visit,business,Love,Fear,0.1,Surprise,BBCWorld,7,2,0,1,0,0
1234,1557351572958576643,jailed poet varavara rao gets bail indias supreme court,politics,Fear,Fear,0.0,Fear,BBCWorld,2,5,1,2,0,0
1235,1557347549006237696,urgent polio boosters london children,politics,Fear,Fear,0.0,Surprise,BBCWorld,6,3,0,1,0,0
1236,1557344018597568512,mexicos indigenous groups celebrate their heritage,entertainment,Love,Fear,0.0,Surprise,BBCWorld,4,2,1,1,0,0
1237,1557339735177175041,we want our bodies be secure 24 7 we dont want be scared go outside south africa gang rape survivors call justice,politics,Joy,Fear,0.325,Fear,BBCWorld,4,4,0,2,0,0
1238,1557335721459032064,palestinian workers forced get off israeli bus,business,Fear,Fear,0.2,Fear,BBCWorld,2,4,1,3,0,0
1239,1557332206539898882,i lost everything flash floods pakistani province balochistan have killed more than 550 people since june destroying homes livelihoods,business,Fear,Sad,0.16666666666666666,Sad,BBCWorld,5,4,0,1,0,0
1240,1557329531987542016,as trumps supporters urge him run president again search mar lago has lit match ex president writes,politics,Love,Surprise,0.0,Surprise,BBCWorld,1,5,2,2,0,0
1241,1557326876850507777,meet indian women who made chess history,entertainment,Love,Fear,0.0,Sad,BBCWorld,2,3,0,0,0,0
1242,1557323145366966274,why homeowners china stopped paying their mortgages,business,Fear,Fear,0.0,Fear,BBCWorld,6,2,1,1,0,0
1243,1557316371637231623,infamous death road bolivia becomes haven wildlife,sport,Sadness,Fear,1.0,Sad,BBCWorld,6,1,2,1,0,0
1244,1557311071400202240,us police arrest man over murders muslim men,politics,Sadness,Fear,0.0,Surprise,BBCWorld,5,3,1,1,0,0
1245,1557305518955323392,beluga whale which became stranded frances seine river dies during rescue mission,business,Fear,Fear,0.0,Surprise,BBCWorld,1,7,1,1,0,0
1246,1557408437927034880,todays newsletter read about how janata dal u leader took oath as chief minister eighth time wednesday with as his deputy preview here,politics,Love,Surprise,0.0,Surprise,the_hindu,0,0,0,0,0,0
1247,1557406766882689026,rt continuing rainfall catchment areas resultant discharge over 1 64 cusecs water tungabh,business,Love,Sad,0.0,Sad,the_hindu,0,0,0,0,0,0
1248,1557403947219943430,british health authorities have advised that one nine year olds throughout receive vaccine booster after detection poliovirus sewage eight london boroughs u k health security agency ukhsa said wednesday,politics,Love,Fear,0.0,Fear,the_hindu,0,0,0,0,0,0
1249,1557402493058965516,rt court has dismissed bail application accused case where 20 year old woman was allegedly abducted,politics,Joy,Fear,0.15000000000000002,Fear,the_hindu,0,0,0,0,0,0
1250,1557402484489986048,rt commercial vehicle manufacturer ltd all will be introducing complete variants lng cng trucks ha,tech,Love,Surprise,0.2,Surprise,the_hindu,0,0,0,0,0,0
1251,1557397260308283395,rt explained why did prefer sslv over pslv or gslv what was designated function satellites bo,tech,Love,Happy,0.0,Happy,the_hindu,0,0,0,0,0,0
1252,1557397243036110849,rt cholamandalam financial holdings ltd cfhl core investment company murugappa group has posted 63 growth,business,Love,Fear,0.0,Fear,the_hindu,0,0,0,0,0,0
